{
  "schema_version": "obs.recorder_blackout_report.v1",
  "target_id": "local",
  "incident_id": "INC-001",
  "window_id": "win-001",
  "time_range_mono_ns": {
    "start": 1000000,
    "end": 61000000
  },
  "blackout_detected": false,
  "sources": [
    {
      "schema_version": "obs.recorder_log_source_status.v1",
      "target_id": "local",
      "source_id": "app_log",
      "source_kind": "append_file",
      "source_ref": "target://logs/app_log",
      "cursor_mode": "append_offset_fallback",
      "cursor_token": "128",
      "cursor_confidence": "medium",
      "continuity_state": "silent_with_continuity",
      "capability_status": "supported",
      "permission_status": "readable",
      "last_observed_mono_ns": 61000000,
      "events_observed": 3,
      "events_exported": 3,
      "events_truncated": 0,
      "rotation_detected": false,
      "blackout_ranges": [],
      "artifact_refs": {
        "log_events": "artifact://recorder/incidents/INC-001/log_events.jsonl",
        "blackout_report": "artifact://recorder/incidents/INC-001/blackout_report.json"
      },
      "data_quality": {
        "dropped": false,
        "drop_count": 0,
        "throttled": false,
        "missing": [],
        "truncated": false,
        "clock_confidence": "medium",
        "notes": []
      }
    }
  ],
  "data_quality": {
    "dropped": false,
    "drop_count": 0,
    "throttled": false,
    "missing": [],
    "truncated": false,
    "clock_confidence": "medium",
    "notes": []
  }
}
